{
  "$schema": "https://json-schema.org/draft/2020-12/schema",
  "$id": "urn:jeffrey:offline-update-manifest:v1",
  "title": "Jeffrey offline update manifest v1",
  "type": "object",
  "additionalProperties": false,
  "required": [
    "bundle_format",
    "schema_version",
    "bundle_id",
    "created_at",
    "source",
    "payloads"
  ],
  "properties": {
    "bundle_format": {
      "const": "jeffrey-offline-update"
    },
    "schema_version": {
      "const": "1"
    },
    "bundle_id": {
      "type": "string",
      "pattern": "^[0-9a-f]{8}-[0-9a-f]{4}-[1-5][0-9a-f]{3}-[89ab][0-9a-f]{3}-[0-9a-f]{12}$"
    },
    "created_at": {
      "type": "string",
      "pattern": "^\\d{4}-\\d{2}-\\d{2}T\\d{2}:\\d{2}:\\d{2}Z$"
    },
    "source": {
      "type": "object",
      "additionalProperties": false,
      "required": [
        "type",
        "name",
        "version",
        "acquired_at"
      ],
      "properties": {
        "type": {
          "type": "string",
          "enum": [
            "model",
            "llama_runtime",
            "frontend_library",
            "lolbas",
            "mitre_attack",
            "cve_kev",
            "knowledge",
            "other_approved"
          ]
        },
        "name": {
          "type": "string",
          "minLength": 1,
          "maxLength": 200
        },
        "version": {
          "type": "string",
          "minLength": 1,
          "maxLength": 200
        },
        "acquired_at": {
          "type": "string",
          "pattern": "^\\d{4}-\\d{2}-\\d{2}T\\d{2}:\\d{2}:\\d{2}Z$"
        },
        "origin": {
          "type": "string",
          "minLength": 1,
          "maxLength": 1000
        }
      }
    },
    "payloads": {
      "type": "array",
      "minItems": 1,
      "maxItems": 10000,
      "items": {
        "type": "object",
        "additionalProperties": false,
        "required": [
          "path",
          "size",
          "sha256",
          "role"
        ],
        "properties": {
          "path": {
            "type": "string",
            "minLength": 9,
            "maxLength": 500,
            "pattern": "^payload/[A-Za-z0-9._/-]+$"
          },
          "size": {
            "type": "integer",
            "minimum": 0,
            "maximum": 274877906944
          },
          "sha256": {
            "type": "string",
            "pattern": "^[0-9a-f]{64}$"
          },
          "role": {
            "type": "string",
            "enum": [
              "model",
              "runtime",
              "frontend",
              "knowledge",
              "data",
              "config",
              "other_approved"
            ]
          }
        }
      }
    },
    "notes": {
      "type": "string",
      "maxLength": 4000
    }
  }
}
