{
  "bundle_format": "jeffrey-offline-update",
  "schema_version": "1",
  "bundle_id": "123e4567-e89b-42d3-a456-426614174000",
  "created_at": "2026-01-01T00:00:00Z",
  "source": {
    "type": "mitre_attack",
    "name": "MITRE ATT&CK Enterprise",
    "version": "example-version",
    "acquired_at": "2026-01-01T00:00:00Z",
    "origin": "approved connected staging environment"
  },
  "payloads": [
    {
      "path": "payload/knowledge/enterprise-attack.json",
      "size": 12345,
      "sha256": "0000000000000000000000000000000000000000000000000000000000000000",
      "role": "knowledge"
    }
  ],
  "notes": "Example only; SHA256/size are placeholders and will not verify."
}
